Title,Price,Stock Availability
Nightstruck: A Novel,£50.35,True
"Naturally Lean: 125 Nourishing Gluten-Free, Plant-Based Recipes--All Under 300 Calories",£11.38,True
Meternity,£43.58,True
Memoirs of a Geisha,£49.67,True
Like Never Before (Walker Family #2),£28.77,True
Life of Pi,£13.22,True
Leave This Song Behind: Teen Poetry at Its Best,£51.17,True
King's Folly (The Kinsman Chronicles #1),£39.61,True
John Adams,£57.43,True
How to Cook Everything Vegetarian: Simple Meatless Recipes for Great Food (How to Cook Everything),£46.01,True
How to Be a Domestic Goddess: Baking and the Art of Comfort Cooking,£28.25,True
Good in Bed (Cannie Shapiro #1),£37.05,True
"Fruits Basket, Vol. 7 (Fruits Basket #7)",£19.57,True
For the Love: Fighting for Grace in a World of Impossible Standards,£45.13,True
Finding God in the Ruins: How God Redeems Pain,£46.64,True
Every Heart a Doorway (Every Heart A Doorway #1),£12.16,True
Delivering the Truth (Quaker Midwife Mystery #1),£20.89,True
Counted With the Stars (Out from Egypt #1),£17.97,True
"Chronicles, Vol. 1",£52.60,True
Blue Like Jazz: Nonreligious Thoughts on Christian Spirituality,£25.77,True
