Title,Price,Stock Availability
Whole Lotta Creativity Going On: 60 Fun and Unusual Exercises to Awaken and Strengthen Your Creativity,£38.20,True
What's It Like in Space?: Stories from Astronauts Who've Been There,£19.60,True
"We Are Robin, Vol. 1: The Vigilante Business (We Are Robin #1)",£53.90,True
Walt Disney's Alice in Wonderland,£12.96,True
V for Vendetta (V for Vendetta Complete),£37.10,True
Until Friday Night (The Field Party #1),£46.31,True
"Unbroken: A World War II Story of Survival, Resilience, and Redemption",£45.95,True
Twenty Yawns,£22.08,True
Through the Woods,£25.38,True
This Is Where It Ends,£27.12,True
The Year of Magical Thinking,£43.04,True
The Wright Brothers,£56.80,True
The White Queen (The Cousins' War #1),£25.91,True
The Wedding Pact (The O'Malleys #2),£32.61,True
The Time Keeper,£27.88,True
The Testament of Mary,£52.67,True
The Star-Touched Queen,£46.02,True
The Songs of the Gods,£44.48,True
The Song of Achilles,£37.40,True
The Rosie Project (Don Tillman #1),£54.04,True
